Job Title,Salary Estimate,Job Description,Rating,Company Name,Location,Headquarters,Size,Founded,Type of ownership,Industry,Sector,Revenue,Competitors
Data Scientist,$78K-$133K (Glassdoor est.),"STRATACACHE provides salable customer experiences, empowering retailers to learn deeply about their customers’ shopping preferences and behaviors, allowing for personalized shopper interaction. Our solutions deliver consumer activation at the point-of-decision, generating new sales opportunities and enhanced retail profitability. With 3 million+ software activations globally, we power the biggest digital networks for the world’s largest brands. Across the STRATACACHE family of complementary digital media/ad tech solution companies, we have the technology, expertise and track record to bring retail innovation that delivers results.

Learn more about the STRATACACHE family at www.stratacache.com.

Data Scientist

Do you love data? Do you enjoy creating statistical models and finding insights that make a difference? Are you interested in the future of retail, commerce, and customer analytics? If so, this is the role for you. In this role you will have the opportunity to work with software engineering, sales, and product organizations to develop innovative, impactful data applications. Your efforts will enhance the overall product quality utilizing many aspects of data science, including various types of modeling that drive toward strategic analytics. You will be focused on the future of the restaurant and retail experience by discovering insights while creating strategic, marketing, retail, customer experience and digital analytics. Your background in statistics, data science, big data, normalization, modeling, quantitative research, and/or analytics consulting will be very beneficial as you take on this exciting position in the company and join our Data Science team. In this role you will also have the opportunity to continue to build and improve the marketing of technology products that are influenced by data, understand human behavior and determine how to influence and impact the retail marketplace with exciting new solutions and insights.

Responsibilities include:

Design, build, and deliver statistical models and related actionable data-focused results to support product and customer requirements and initiatives.
Work closely with engineering, product and sales teams to understand business and technical requirements, translate these into important discovery directives, and follow through to optimize and support the enhancement and growth of Stratacache products.
Establish and make effective use of internal and external datasets to back up and support key strategic, product, and customer decision-making efforts.
Serve as the data science expert on cross-functional teams for large strategic initiatives and education on accessing and utilizing qualified and focused data for decision making.
Analyze, propose, design and successfully deliver data experiments for engineering, product and sales teams to ensure statistical rigor and effectiveness.
Provide expertise and professionalism in handling sensitive, privacy-protected data, including sources, structures, organization, and optimization.
Communicate complex ideas about our product through visual aids like charts and dashboards.
Keep up-to-date with emerging data science and statistical technologies, methods and practices.
Create and/or use existing data models for predictions regarding user behavior.
Communicate ideas, processes, and results to all levels of internal and external clients and teams.
Basic & Preferred Qualifications
Bachelor's degree required in Computer Science, Mathematics, Statistics, Quantitative Analysis, or other technical field related to software development.
Minimum 3 years of related experience working with data science and statistical modeling.
Experience in the QSR, retail or ecommerce industries from a data perspective is required.
Experience with recommendation engines and discovering new and advanced modeling methods i.e. deep neural networks, gradient boosted decision trees, etc.. is required.
Experience with SQL and at least one functional or statistical programming language is required.
Minimum of 3 years of related experience working with R and Python is required.
Minimum of 3 years of related experience working with REST APIs is required.
Experience working with Postgres, Timescale DB and/or other related database technologies is required.
Ability to distill complex statistical concepts and methodology, and articulate insights to cross-functional teams and clients with varying levels of knowledge in this space is required.
Ability to work with distributed and remote teams is required.
Experience with complex query writing is required.
Experience with result-set performance tuning and related data administration is required.
Experience with big data technologies is required.
Experience and understanding of various statistical modeling tools and platforms is required.
Experience in ecommerce, wifi, app messaging, social and other datasets is beneficial.
Experience in machine learning and artificial intelligence methods and practice is beneficial.
Understanding and experience with database technologies is beneficial including Oracle, SQLServer, etc..
Understanding and experience with BI technologies is beneficial: Tableau, Microstrategy, Microsoft, OBI, etc..
Experience with kafka, Go, or Redis is beneficial.
Understanding of data modeling techniques and star schemas is beneficial.
Experience with Hadoop and MapReduce is beneficial.
Experience with ftp, file transfers, data exchange methodologies.
A solid understanding of methodology, data and systems from a broad range of research and analytics providers, including emerging tools and methods is required.
Ability to articulate and tie data to business strategy.
Microsoft Excel and PowerPoint skills
Self-motivated, self-starter with a team-centric focus while working in a fluid environment.
Exceptional communication skills: verbal, written, and presentation.
Experience in the following areas: strategic analytics, marketing analytics, digital analytics, data analytics, statistics, data science, big data, normalization, modeling, quant research, analytics consulting.
Desire and interest to uncover and discover insights using disparate data sources.
Desire and interest in being the “Go To” person for data science.
Dynamic personality and passion for data, analytics, visualizations and storytelling is beneficial for this role.
Keen sense of user interface design, style, aesthetics and effective visual presentation.
Experience with agile development methodologies.
Ability to work effectively in fast-paced, results-oriented work environment.
Ability to handle and adjust to change in requirements and direction.
Positive attitude, attention to detail, and great problem solving skills are important.

STRATACACHE and its family of companies provides equal employment opportunities (EEO) to all employees and applicants for employment without regard to race, color, religion, creed, sex, sexual orientation, gender identity, national origin, age, disability, genetic information, pregnancy, childbirth or related medical condition, veteran, marital, parental, citizenship, or domestic partner status, or any other status protected by applicable national, federal, state or local law.

While we are excited and appreciate you interest in our opportunities, please keep in mind that we are not able to contact all applicants that have applied.

No vendor/agency solicitation please.",3.6,"STRATACACHE
3.6","Dayton, OH",-1,201 to 500 Employees,1999,Company - Private,Computer Hardware & Software,Information Technology,$100 to $500 million (USD),-1
Data Scientist,$78K-$133K (Glassdoor est.),"Job Brief

The ideal candidate will have previous Data Modeling experience. Strong preference will be given to candidates with an actuarial background in the property and casualty insurance space.

Overview

IFG Companies is in search of a Data Scientist to join its growing Predictive Modeling team.

The ideal candidate will have previous Data Modeling experience. Strong preference will be given to candidates with an actuarial background in the property and casualty insurance space.

Responsibilities
Build predictive and/or Machine Learning models in SAS
Research new statistical and mathematical techniques that are suitable and helpful for solving business related problems
Prepare data for modelling and make best/creative use of applicable and available internal or external data
Identifying and integrating new datasets that can be leveraged for modeling efforts
Support related processes around effectively deploying model to business
Effectively communicate results in written, oral and presentation formats to technical and non-technical audiences
Qualifications
Bachelor’s degree in statistics, applied mathematics, or related discipline
3+ years of Data Modeling or similar experience.
Experience with predictive modeling (classification, regression, parameter tuning, optimization criteria, feature selection), preferably with multiple techniques
Experience in model validation techniques, model testing and continuous monitoring of model performance
Experience in Property & Casualty Insurance is strongly preferred.
Demonstrated experience working with large relational data sets.
Working knowledge in SAS, R, Python or another platform to develop and implement predictive models.
Ability and willingness to quickly gain knowledge of SAS enterprise guide and enterprise miner.
Ability to communicate complex technical information in common language to foster teaching and analytics guidance to internal customers.
Advanced experience in analytics, data cleaning, and predictive modeling.
Ability to write queries in SQL.
Detail-oriented and ability to work collaboratively
Physical Demands
Physical demands are considered to be that of an office environment, climate controlled, with minimal physical exertion. This position requires prolonged sitting, ability to utilize a computer and interactions with others in meetings or via phone.
Benefits
We offer a competitive compensation and benefits package including medical, dental, vision, 401(k), flexible spending, short-term and long-term disability insurance, life insurance, long-term care, education assistance and paid time off.
IFG Companies is an equal opportunity employer committed to a diverse workforce. M/F/D/V",2.9,"IFG Companies
2.9","Atlanta, GA",-1,201 to 500 Employees,1985,Company - Private,Insurance Carriers,Insurance,Unknown / Non-Applicable,-1
Data Scientist-Junior,$78K-$133K (Glassdoor est.),"Business Group Highlights

Defense

The Defense group supports the Department of Defense (DoD) mission to keep our homeland and its citizens safe. We provide solutions to improve the Nation's defense by providing software, systems engineering, IT, training and logistics and fleet management solutions.

Responsibilities

This position is for a large contract for the Army, providing leadership and support existing systems, processes, and policies as well as working to implement new technologies and processes in support of the client’s mission to provide Intelligence training and technologies to military personnel.

Provides data science and data engineering support to targeting activities that bring in large datasets. Data science and data engineering support is needed to help manage and execute the ingest (extract, transform and load (ETL) operations), parsing, data normalizations, database design, as well as performing data analysis at scale and implementing algorithms to find impactful operational and finished intelligence in large data streams. Involved in the analysis of unstructured and semi-structured data. Exercises creativity in applying non-traditional approaches to large-scale analysis of unstructured data in support of high-value use cases. Handles processing against high-volume collections of data and high-velocity data streams. Has the ability to make discoveries in the world of big data. Requires strong technical and computational skills coupled with the ability to code, design, develop, and deploy sophisticated applications using advanced unstructured and semi-structured data analysis techniques. Has the ability to utilize advance tools and computational skills to interpret, connect, predict and make discoveries in complex data and deliver recommendations. Develops documentation to support objectives of operationally-focused team members.

Qualifications

3 years experience and a BA/BS degree

Responsible for assisting more senior positions and/or performing functional duties under the oversight of more senior positions.

Current TS/SCI clearance

Bachelor of Science Degree or higher computer science, statistics, or other related STEM (Science, Technology, Engineering, or Math)

Desired qualifications:

Strong understanding of data engineering, structure, formatting, conditioning and analysis.
Knowledge of database tools and current data science processes.
Full-stack development experience.

Desired Skills:

Thorough/Working knowledge of Python and some of the following software/tools: SQL, R, Hadoop, Spark, Java, C/C++, Git Bash, Tableau, ArcGIS, Unix commands.
Thorough/Working knowledge of research designs.
Thorough/Working knowledge of collection methods, capabilities and tasking process.
Familiarity with project management concepts and principles.
Intellectual curiosity; creativity and innovation to go beyond current tools to deliver the best solution to complex problems.
Strong analytical and critical thinking skills

About Perspecta

What matters to our nation, is what matters to us. At Perspecta, everything we do, from conducting innovative research to cultivating strong relationships, supports one imperative: ensuring that your work succeeds. Our company was formed to bring a broad array of capabilities to all parts of the public sector—from investigative services and IT strategy to systems work and next-generation engineering.

Our promise is simple: never stop solving our nation’s most complex challenges. And with a workforce of approximately 14,000, more than 48 percent of which is cleared, we have been trusted to do just that, as a partner of choice across the entire sector.

Perspecta is an AA/EEO Employer - Minorities/Women/Veterans/Disabled and other protected categories.

As a government contractor, Perspecta abides by the following provision

Pay Transparency Nondiscrimination Provision

The contractor will not discharge or in any other manner discriminate against employees or applicants because they have inquired about, discussed, or disclosed their own pay or the pay of another employee or applicant. However, employees who have access to the compensation information of other employees or applicants as a part of their essential job functions cannot disclose the pay of the other employees or applicants to individuals who do not otherwise have access to compensation information, unless the disclosure is (a) in response to a formal complaint or charge, (b) in furtherance of an investigation, proceeding, hearing, or action, including an investigation conducted by the employer, or (c) consistent with the contractor’s legal duty to furnish information. 41 CFR 60-1.35(c).",3.2,"Perspecta
3.2","Washington, DC",-1,10000+ Employees,2018,Company - Public,Aerospace & Defense,Aerospace & Defense,Unknown / Non-Applicable,-1
"Data Scientist, Machine Learning",$78K-$133K (Glassdoor est.),"Job Description

At Shipt, we are transforming the grocery shopping experience and giving time back to consumers. Shipt shoppers handpick fresh groceries and household essentials, then deliver them to your door in as little as one hour.

Shipt is growing and we are searching for a Data Scientist, Machine Learning to join our team! At Shipt, we're using machine learning (ML) and analytics to drive our business forward. We're looking for help understanding our data, optimizing our processes, and making predictions to improve our product and customer experience.

The data science team builds data driven solutions using machine learning and modeling techniques. Our solutions include predictive models, clustering, segmentation, complex reporting, and quantitative research. Our ideal candidate will be data-driven, intellectually curious, and a clear communicator with experience building machine learning models.

What You'll Gain
You will get experience working with a cross-disciplinary team shipping real-world products to our customers around the nation. You will also receive hands-on mentorship from your friendly teammates on topics ranging from design to career advice

Your Responsibilities
Develop a thorough understanding of our data and interpret them as they relate to shopper behavior, search performance, profitability, and product development
Build predictive models and optimization routines to capture opportunities and solve problems. Applications include modeling demand in a given market, delivering search recommendations, and optimizing internal processes
Collaborate with other members of the Data Science and engineering teams on ways to approach problems, augment code, and share new techniques
Work with functional team leaders (in Product, Operations, Marketing, etc.) to explain your analysis, findings, and recommendations
Find opportunities for improvement across the business and assist in decision-making across teams
Stay abreast of developments in the field and contribute to its advancement
Requirements
At least 2 years of experience with machine learning, predictive modeling, and/or optimization techniques
High degree of proficiency with one of R or Python
Proficiency with SQL
Experience with a data visualization tool (Tableau, Chartio, Looker, Spotfire, Power BI, etc.)
Experience with cloud computing services or platforms
Comfortable giving verbal presentations and communicating with technologies like Zoom and Slack
Bachelor's degree in a quantitative field or related experience
Nice to Haves
Experience deploying predictive models in a cloud environment
Experience with batch processing framework
Familiarity with AWS, version control, and peer code review systems
Familiarity with on-demand and/or multi-sided marketplaces
Proficiency in both R and Python
We are an equal opportunity employer and value diversity at our company. We do not discriminate on the basis of race, religion, color, national origin, gender, sexual orientation, age, marital status, veteran status, or disability status.",3.4,"Shipt
3.4","Birmingham, AL",-1,1001 to 5000 Employees,2014,Subsidiary or Business Segment,Consumer Product Rental,Consumer Services,Unknown / Non-Applicable,-1
STAFF SCIENTIST,$78K-$133K (Glassdoor est.),"Position: Staff Scientist

Requisition Number: 2020-2410-09

S&ME is an employee-owned engineering firm that provides civil, geotechnical, environmental, planning, landscape architecture, survey and construction services. Consistently ranked in the top 100 of ENR's Top 500 Design Firms, our markets are diverse and include transportation, energy, water/wastewater, commercial development, industry, healthcare, education and government. We recruit top talent and are currently seeking a Staff Scientist to join our team in Chattanooga, Tennessee.

The individual will perform field and office work associated with environment evaluations. Field work will include: soil sampling, groundwater sampling, surface water sampling, sediment sampling, wetland delineations, stream classifications, and fauna/flora identification. Other responsibilities include completing data entry to capture field activities, and the preparation of standard environmental reports. This individual will be expected to maintain knowledge of, and compliance with, regulatory requirements by attending environmental or natural resources training courses, or other in-house trainings. This position will require some travel and overnight stays.

Qualifications:
BS in environmental science, geology, biology, chemistry or related field;
2-4 years field experience in related field;
Ability to work outdoors in varying weather conditions;
Ability and willingness to accommodate overnight and out-of-town assignments;
Good technical writing, verbal communication, and computer skills.
This is a full-time position with competitive pay based on experience. Successful candidate must meet requirements of the company's Fleet Management Program, Substance Policy and Reference Check program. Submit resume, cover letter, and salary expectations for consideration. Only qualified candidates with acceptable employment eligibility verification (I-9) will be considered. Visa assistance not provided. S&ME reserves the right to fill this position with an internal or external candidate at any time during the search. S&ME is not responsible for unauthorized job postings or submissions of resumes using external links/websites.

No candidate/recruiter calls, personal calls or walk-ins accepted.

An Equal Opportunity Employer.

Minorities/Females/Disability/Veterans; VEVRAA Federal Contractor

Job Posted by ApplicantPro",3.6,"S&ME, Inc.
3.6","Chattanooga, TN",-1,1001 to 5000 Employees,1973,Company - Private,Architectural & Engineering Services,Business Services,$100 to $500 million (USD),-1
Data Scientist,$78K-$133K (Glassdoor est.),"Job Title: Data Scientists

Job Description
Join an elite group dedicated to continuous personal improvement as GCT is currently seeking Data Scientists of all levels to support an intelligence agency with insights gained from analyzing voluminous sensor data. The ideal candidate is adept at using large data sets to find opportunities for process optimization and using models to test the effectiveness of different courses of action. Candidates must have strong experience using a variety of data mining/data analysis methods, using a variety of data tools, building and implementing models, using/creating algorithms and creating/running simulations. The right candidate will have a passion for discovering solutions hidden in large data sets and working with stakeholders to improve business outcomes.

Clearance: TS/SCI w/Full scope polygraph (or used within the past 24 months)

Education/Experience Requirements

Senior Positions:
Masters degree in Data Science, Statistics, Mathematics, Computer Science or another quantitative field, or extensive comparable experience
10+ years of relevant experience
Junior/Intermediate Positions
Completed B.S. in Data Science, Mathematics, Statistics, Computer Science, Computer Engineering, or a closely related technical field
3-9 years of relevant experience
Qualifications
Experience using statistical computer languages (SAS, SPSS, R, Python, SLQ, etc.) to manipulate data and draw insights fromlarge data sets
Experience working with and creating data architectures
Knowledge of a variety of machine learning techniques (clustering, decision tree learning, artificial neural networks, etc.) and their real-world advantages/drawbacks
Knowledge of advanced statistical techniques and concepts (regression, properties of distributions, statistical tests and proper usage, etc.) and experience with applications
Excellent written and verbal communication skills
Strong problem solving skills
A drive to learn and master new technologies and techniques
Desired Skills
Experience manipulating data sets and building statistical models
Coding knowledge and experience with several languages: C, C++, Java, JavaScript, etc.
Knowledge and experience in statistical and data mining techniques: GLM/Regression, Random Forest, Boosting, Trees, text mining, social network analysis, Bayes, etc.
Experience querying databases and using statistical computer languages: R, Python, SLQ, etc.
Experience using web services: Redshift, S3, Spark, DigitalOcean, AWS, etc.
Experience creating and using advanced machine learning algorithms and statistics: regression, simulation, scenario analysis, modeling, clustering, decision trees, neural networks, etc.
Experience analyzing data from 3rd party providers: Google Analytics, Site Catalyst, Coremetrics, Adwords, Crimson Hexagon, Facebook Insights, etc.
Experience with distributed data/computing tools: Map/Reduce, Hadoop, Hive, Spark, Gurobi, MySQL, etc.
Experience visualizing/presenting data for stakeholders using: Periscope, Business Objects, D3, ggplot, etc.
The success of Great-Circle Technologies depends on the success and well-being of its employees. GCT promotes work/life balance and encourages the overall well-being of each of its contributors. A comprehensive benefits package is provided, which currently includes company paid single medical, dental, life, disability, and long-term care insurances (with contributions to family premiums,) matching 401k plan, 34 days off per year including 10 Federal holidays plus the day after Thanksgiving, Christmas and New Year’s eves!

Join us at Great-Circle Technologies, where innovation is the shortest distance between two points.

Great-Circle Technologies is an Equal Opportunity Employer. Great-Circle Technologies ensures all qualified applicants will receive consideration for employment without regard to gender, race, ethnic background, religion, disability, sexual orientation, gender identity, national origin, age, or protected veteran status.",2.2,"Great-Circle Technologies
2.2","Chantilly, VA",-1,1 to 50 Employees,2000,Company - Private,Enterprise Software & Network Solutions,Information Technology,$1 to $5 million (USD),-1
