Job Title,Salary Estimate,Job Description,Rating,Company Name,Location,Headquarters,Size,Founded,Type of ownership,Industry,Sector,Revenue,Competitors
Data Scientist,$78K-$133K (Glassdoor est.),"Publishers Clearing House (PCH), located in Jericho, NY is looking for a strongData Scientist who is passionate about using the power of algorithms to drive customer engagement and monetization. As a part of our Analytics team, you will be utilizing enormous volumes of data on customers, PCH products, channels, and developing advanced statistical algorithms to solve unique business problems. This is an exciting opportunity to work with big data to build data products backed by algorithms to delight customers and to drive significant advances in PCH Commerce (online and Direct Mail), Search, Online Gaming, and Digital Advertising business.

Responsibilities include but are not limited to:
Work comfortably with multi-terabyte, and billion+ rows data to extract insights and building predictive models to maximize profit
Utilize large-scale data mining and machine learning techniques to discover actionable patterns in the data
Perform rigorous model development, evaluation, design hypothesis tests, oversee test execution and result evaluation
Communicate complex analyses in a clear and actionable manner
Desired skills, experience& qualifications:
Masters degree required in Machine Learning, Applied Math, Computer Science, Economics, Statistics, or a related quantitative field
2 to 5 years’ experience in building predictive models using SAS Enterprise Guide (EG) , SAS Enterprise Miner or/and Python
Solid understanding of advanced statistical concepts, especially related to modelling is a must
Experience with publishers and or ad tech companies, experience in media, advertising and marketing vertical is a plus
Knowledge of programmatic advertising and digital acquisition. Experience in building optimization models /algorithms for media spends and maximize CPM
Experience working with enterprise-level digital analytics platform such as Google Analytics is a plus
Experience with cloud platforms AWS or Google Could Platforms (preferred)
Experience with ETL and building data pipelines and familiarity with distributed storage and big data computing technology is a plus
Excellent communication and presentation skills
Publishers Clearing House (PCH), headquartered in Jericho, NY, and with offices in NYC, Portland, ME and Boston, MA, is a leading direct-to-consumer company offering a broad range of products, digital entertainment services to consumers as well as customized solutions for advertisers. Our continued success in today’s new digital publishing environment is built on PCH’s unique, free-to-play, chance-to-win value proposition, which enables individually personalized offers based on the trusted first-party relationship we maintain with millions of consumers and is fueled by the excitement of the Publishers Clearing House brand.

Join our winning team and apply today!

This position is located in Jericho, NY. Candidates must reside in the NY tri-state area

PCH is an Equal Opportunity Employer",3.4,"Publishers Clearing House
3.4","Jericho, NY",-1,501 to 1000 Employees,1953,Company - Private,Advertising & Marketing,Business Services,$500 million to $1 billion (USD),-1
Associate Data Scientist,$78K-$133K (Glassdoor est.),"Job Description

As an Associate Data Scientist, you will apply modern data storage, movement, and transformation architectures and techniques to extract and engineer features from any scale structured or unstructured data in health, IT system, business processes, or external data. You will also access, cleanse, compile, and transform disparate data sets to conduct exploratory and pre-defined analyses using scientifically valid techniques and generate meaningful insights as well as assist with feasibility studies to identify data availability, quality and modeling requirements, and dependencies.

Qualifications

Basic Qualifications
Master’s Degree in Statistics, Computer Science, Analytics, Biostatistics, Applied Mathematics, Software Engineering, Data Science, or related field, or equivalent relevant work experience
At least 1 year of statistical programming and applied programming work experience
At least 1 year Data mining, quantitative analysis, and/or statistical modeling including predictive performance and algorithm optimization work experience
Preferred Qualifications
Experience with relational databases and SQL; NoSQL databases (hBase, Cassandra, MongoDB, Couch DB, Riak) and unstructured data; Spark; Pig and Avro
Experience with agile software development methodologies
Expectations
Willing to travel up to 20% of the time as needed
Must be currently residing in or willing to relocate to the Kansas City metro area",3.9,"Cerner
3.9","North Kansas City, MO",-1,10000+ Employees,1979,Company - Public,Computer Hardware & Software,Information Technology,$5 to $10 billion (USD),-1
Data Scientist,$78K-$133K (Glassdoor est.),"Job Description:

Our Advanced Data Analytics division in Reston, VA is seeking a talented Data Scientist for R&D projects with large amounts of complex data. As a Data Scientist you will be responsible for designing, implementing, and analyzing the results of innovative solutions to clients’ challenging machine learning and data mining problems. Applicants interested in applying only off-the-shelf solutions need not apply. Project teams are small, typically 2-5 people including Data Scientists, Mathematicians, and Software Developers. Each person is involved in the project’s entire process, from concept through design and implementation to demonstration. Our management structure gives you the freedom to create innovative designs and products. The ideal candidate will have experience writing well-documented, maintainable, and extensible software and APIs.

Required Qualifications:
Bachelor’s or Master’s degree in Machine Learning, Data Science, Computer Science, Mathematics, Statistics, or a related field
Significant experience developing and knowledge of best practices for evaluating innovative, scalable anomaly detection, classification, recommendation, and related algorithms
Significant programming experience in Python, Java, Scala, or R
Experience with machine learning software libraries such as scikit-learn and Weka
Understanding of deep learning algorithms and experience with related libraries such as TensorFlow, Torch, and Deeplearning4j a plus
Experience with big data tools such as Apache Spark, Mahout, or Storm a plus
Experience with NLP (Natural Language Processing) a plus
Ability to communicate algorithm design, performance metrics, and data analyses in written and oral reports
US CITIZENSHIP REQUIRED; applicants selected will be subject to a security investigation and will need to meet eligibility requirements for access to classified information

Position Location: Reston, VA

All qualified applicants will receive consideration for employment and will not be discriminated against on the basis of race, color, religion, sex, sexual orientation, gender identity, national origin, age, disability, or protected veteran status. Metron takes affirmative action in support of its policy to employ and advance in employment individuals who are minorities, women, protected veterans, and individuals with disabilities.

VEVRAA Federal Contractor",3.0,"Metron, Inc.
3.0","Reston, VA",-1,51 to 200 Employees,-1,Company - Private,Electrical & Electronic Manufacturing,Manufacturing,$25 to $50 million (USD),-1
Sr. Data Scientist,$78K-$133K (Glassdoor est.),"Overview:

Medifast is seeking a full-time Senior Data Scientist to join our team.

The Senior Data Scientist will be responsible for anticipating future business needs, solving real-time business questions, and identifying new applications for complex analysis.

The candidate focus will be using Machine Learning for the following use cases at Medifast:
Demand Forecasting, Recommendation Engines, Sentiments Analysis, Survival Analysis, Natural Language Processing, AB Testing, and Customer Segmentation (Unsupervised Learning).

Responsibilities:
Employ machine learning and statistical modeling to generate new features to feed into our data core. Key Models include: Demand Forecasting, Recommendation Engines, Sentiments Analysis, Survival Analysis, and Customer Segmentation
Use storytelling to bring out the insights derived from machine learning and statistical modeling making the complex easy to follow and digestible
Perform automated market analyses to dynamically react to changing market conditions
Discover new predictive insights in our datasets and design measures that compute new predictive models while using data visualization methodology
Assist the Insights Center Manager in using Data Science to enhance the Insights Roadmap and assist in the selection of Data Science products to help enable and maintain the Data Science stack
Create measures that monitor inputs and performance on a real-time basis to inform the insights council when unexpected changes arise.
Be active in communications with business users and data management resources to collaborate through a project lifecycle as data changes occur
Aid and train end super users to effectively use the Data Science platform
Coordinate with offshore technical resources
Qualifications:
PHD degree or equivalent preferred in Applied Statistics, Mathematics or a related data field
5-8 years related experience
Executing solutions to business problems using advanced statistics, testing methods, data analysis, data mining, predictive modeling, optimization, and machine learning techniques;
Design and run end-to-end experiments with statistical rigor for test and learn, apply appropriate sampling methods and probabilistic simulations to hypothesis testing and parameter estimation including bootstrapping
Perform data exploration and visualization (using Tableau and other visualization tools), apply machine learning and statistical inference to seed hypotheses, identify opportunities, define metrics, provide interpretability to multi-dimensional scoring, regressor and classifier models, and decision tree learning, using novel methods;
Employ statistical programming through, Python, R, Dataiku, and toolkits (Scikit-learn, Pandas, Numpy, Scipy, PySpark, Jupyter Notebook and kernel, Macro) across disparate environments including Linux/Unix command line and shell scripting, virtual and clouds
Execute and automate data preprocessing via relational systems (AWS, Redshift, SQL Server, MySQL, Postgre, and, Oracle), and parallel computing for big data, using analytics engine and cluster computing frameworks: Apache Spark and Hadoop MapReduce, Apache Tez, and Yarn.

#LI-LW1",2.9,"Medifast, Inc.
2.9","Baltimore, MD",-1,501 to 1000 Employees,1980,Company - Public,"Health, Beauty, & Fitness",Consumer Services,$500 million to $1 billion (USD),-1
"Senior Data Scientist - Remote, CT, MD, MA",$78K-$133K (Glassdoor est.),"Who We Are
Stanley Black and Decker (SBD) is committed to deep and ongoing investment in Big Data & Analytics. SBD believes that advanced analytics using massive data, while already important to our business, will increasingly become fundamental – even transformational – to the value we deliver to our customers and shareholders. Our centralized Data & Analytics Organization leverages a cloud-based data infrastructure and state of the art analytics environment to solve various business problems ranging from sales, marketing and pricing modeling to demand forecasting, inventory optimization and customer lifetime value. Our data scientists have a chance to use cutting edge AI and machine learning tools, explore many internal and external data sets and work closely with dedicated business partners across the entire organization.

Who You Are
You’re a curious problem solver who has the ability to bring big ideas to life. You’re creative and scrappy but can navigate a large organization with ease. You’re agile and adaptable but work with precision to ensure we deliver top-notch customer experiences, always. You will be responsible for providing strategic leadership for the development, validation and delivery of data science / analytics models and reporting tools. The successful candidate will act as the analytic team lead for highly complex projects. You'll have:
Advanced degree (MS/PhD) in a relevant technical field (e.g., Computer Science, Mathematics, Applied Mathematics, Statistics, Operations Research, Industrial Engineering, Econometrics) with 7+ years of experience in related data science, data analytics, machine learning and predictive modeling roles
Experience working with large complex data sets, real time/near real time analytics, and distributed big data platforms (Hadoop & MapReduce and/or Cassandra/Spark)
Understanding of how digital marketing works and marketing ecosystem
Familiarity with the different digital marketing media, including PPC, ads placement, Amazon advertising and SEO along with their associated metrics.
Strong practical knowledge of analytical techniques and methodologies such as machine learning/supervised and unsupervised techniques, segmentation, mix and time series modeling, response modeling, lift modeling, experimental design, neural networks, data mining and optimization techniques
Strong background in applying statistical machine learning techniques to predictive modeling and experience with Machine Learning libraries (via R, H2O, Python, Spark, etc.)
Proficiency in programming in Python, R, SQL, JavaScript, Java/Scala/Ruby and shell scripting
Proficiency in consuming REST based API (with JSON payload) is a plus.
Fluency in big data platforms including Hadoop, MapReduce, Hive, Spark, PIG
Familiarity with Cloud based HaaS/PaaS solutions such as AWS EMR, MS Azure.
A strong understanding of data profiling and data cleansing techniques
Natural curiosity and a strong passion for empirical research and problem solving
Strong written and verbal communications skills; comfortable communicating with senior levels of both business and technology leadership.
What You’ll Do :
Work with a wide range of large complex data sets, real time/near real time analytics, and distributed big data platforms (Hadoop & MapReduce and/or Cassandra/Spark) across entire SBD to solve highly complex real-world business problem.
Determine and design appropriate analytical approaches and predictive modeling techniques with Machine Learning libraries (via R, H2O, Python, Spark, etc.) for these business problems and leads their development and execution.
Identify potential analytical use cases, evaluate their feasibility and quantify potential future business impact
Drive the collection, cleansing, processing and analysis of new and existing internal and external data sources.
Establish analytical rigor and predictive methods to analyze large amounts of data using advanced analytics techniques.
Build, test, and deploy predictive models and/or machine learning algorithms on very large static and/or streaming data sets
Report findings by creating useful and appropriate data outputs and visualizations tailored for the intended audiences
Work with complex and extremely wide range of data sets across entire SBD to solve highly complex real-world business problems
Manage highly complex analytical projects from data exploration, model building, performance evaluation and testing.
Provide thought leadership and direction for analytic solutions, tools and studies.
Provide guidance to develop enterprise-wide analytics strategy and roadmap.
Interact with internal and external peers and management to share highly complex information/solutions related to areas of expertise and/or to gain acceptance of new or enhanced technology/ business solutions.
Learn & stay current on analytics developments in one or more business domains: Image Processing, Internet of Things, Digital Manufacturing, Supply Chain Optimization, Demand Forecasting, Sales & Marketing, Pricing, etc.

Benefits & Perks
You’ll get a competitive salary and a comprehensive benefits plan that includes medical, dental, life, vision, wellness program, disability, 401k, Employee Stock Purchase Plan, Paid Time Off, including paid vacation, holidays & personal days, and tuition reimbursement. And, of course, discounts on Stanley Black & Decker tools and products and well as discount programs for many other vendors and partners.

What You’ll Also Get
Career Opportunity: Career paths aren’t linear here. Being part of our global company with 60+ brands gives you the chance to grow and develop your skills along multiple career paths.
Learning & Development: Our lifelong learning philosophy means you’ll have access to a wealth of state-of-the-art learning resources, including our Lean Academy and online university (where you can get certificates and specializations from renowned colleges and universities).
Diverse & Inclusive Culture: We pride ourselves on being an awesome place to work. We respect and embrace differences because that’s how the best work gets done. You’ll find we like to have fun here, too.
Purpose-Driven Company: You’ll help us continue to make positive changes in the local communities where we work and live as well as in the broader world through volunteerism, giving back and sustainable business practices.

Stanley Black & Decker is one of the world's largest, fastest growing and most dynamic companies. SBD, a Fortune 200 company is a world-leading provider of tools and storage, commercial electronic security and engineered fastening systems, with unique growth platforms and a track record of sustained profitable growth.

#LI-AH1

EEO:
All qualified applicants to Stanley Black & Decker are considered for employment without regard to race, color, religion, age, sex, sexual orientation, gender identity, national origin, disability, veteran’s status or any other protected characteristic.",3.2,"Stanley Black & Decker
3.2","New Britain, CT",-1,10000+ Employees,1843,Company - Public,Industrial Manufacturing,Manufacturing,$10+ billion (USD),-1
Data Engineer,$78K-$133K (Glassdoor est.),"SUMMARY OF RESPONSIBILITIES: *
This class is responsible for creating, maintaining, and evolving the organization's strategy for data storing, transformation, and distribution to ensure data quality and value for analytics, to include translating business requirements into conceptual, logical, and physical data models that will support data analysis/visualization and decision-making across all divisions. Responsibilities will include, but not be limited to cleaning and transforming data into a useful state, creating, extending, and maintaining logical entity relationship models and diagrams using data modeling tools, technologies and frameworks; maintain work flows that ensure data integrity, synchronization, quality and consistency; create and maintain data dictionary (metadata) to document what technology manages the data, the schema, the size, how the data is secured, the source of the data, definitions, business owners, format, structure of databases, and the relationship between field elements in order to control access to and manipulation of the databases; gather data requirements, such as how long the data needs to be stored, how it will be used, and what people and systems need access to the data; store the data, using specialized technologies that are optimized for the particular use of the data, such as Sisense and/or a relational database, a NoSQL database, etc.; support special initiatives and projects requiring complex data analysis and other support; collaborate with data analytics teams and other staff to build the right solutions; lead data model walk-throughs to ensure clear understanding across all stakeholders and address any issues that arise; analyze and debug performance issues on data models; create, document and store scripts and case scenarios required for testing; write and execute ad-hoc and complex queries to perform data analysis; perform data profiling on source system data to ensure that source system data can be integrated and represented properly in data models. Operating under general supervision of the Data and Analytics Manager, work is performed in accordance with established policies and procedures, with leeway allowed for the exercise of independent judgment in carrying out the details of the work.
KNOWLEDGE, SKILLS, AND ABILITIES: *
• Thorough knowledge of ingestion, processing frameworks and storage engines

• Thorough knowledge architecting distributed systems, creating reliable pipelines, combining data sources, architecting data stores

• Thorough knowledge of batch and stream processing

• Thorough knowledge of Linux and command line tools such as grep, awk, etc.

• Thorough knowledge of SQL and programming such as Java, Python, Scala, R, etc.

• Thorough knowledge and holistic understanding of data as an asset

• Thorough knowledge of safety rules/regulations/procedures, as applicable

• Thorough knowledge in operating computers and applicable software including Microsoft Office tools

• Ability to design and implement data models

• Ability to unlock additional value from data through completion of feasibility studies for assigned use cases

• Ability to use SQL for queries and report building

• Ability to translate logical models into physical models, adding appropriate physical objects to create the objects within the data store (e.g., indexes, sequences, etc.)

• Ability to interpret complex business requirements and create data models across multiple applications that support business goals

• Ability to solve problems independently and provide recommendations for continuous improvement

• Ability to ensure quality control in all work products/outputs

• Thorough knowledge of math concepts and formulas required for data analysis and reporting

• Ability to work as part of a cross functional team

• Ability to use strong analytics skills in interpreting and visualizing data

• Ability to create and maintain reports/records, spreadsheets, documents, tables, etc.

• Ability to organize/prioritize work and provide excellent customer service

• Ability to maintain knowledge on current and emerging technologies and evaluate the impact of new applications and technologies on data structures

• Ability to work with staff across all divisions to maintain data models and processes that are scalable, adaptable, and in synchronization with ever-changing business needs

• Ability to perform troubleshooting/root cause analysis to pinpoint issues and devise resolutions for data/reporting issues

• Ability to share information and insight on source data structures in order to support decision-making for technical and functional modifications to enterprise software applications

Job Type: Full-time

Pay: $70,618.28 - $88,272.86 per year

Benefits:
401(k)
Dental Insurance
Disability Insurance
Employee Assistance Program
Flexible Spending Account
Health Insurance
Life Insurance
Paid Time Off
Professional Development Assistance
Retirement Plan
Tuition Reimbursement
Vision Insurance
Schedule:
8 Hour Shift
Monday to Friday
COVID-19 considerations:
To keep our employees and visitors safe, everyone is required to wear a face covering and submit to wellness screening including a temperature check prior to entering the building.

Experience:
Data Management: 5 years (Preferred)
Education:
Associate (Preferred)
Work authorization:
United States (Preferred)
Company's website:
www.faypwc.com
Company's Facebook page:
https://www.facebook.com/faypwc
Benefit Conditions:
Only full-time employees eligible
Work Remotely:
Temporarily due to COVID-19",3.2,"Fayetteville Public Works Commission
3.2","Fayetteville, NC",-1,501 to 1000 Employees,1905,Government,Energy,"Oil, Gas, Energy & Utilities",$100 to $500 million (USD),-1
